{
  "format_version": "1.0",
  "id": "cb-0153",
  "slug": "topp-28-flip-graph-connectivity-3d",
  "title": "Flip-graph connectivity in three dimensions",
  "field": "computational-geometry",
  "statement": "The bistellar flip graph of every general-position point set in R³ is connected.",
  "counterexample": {
    "description": "A rational general-position point set and two tetrahedralizations in distinct connected components of its flip graph.",
    "finite": true
  },
  "status_observation": {
    "state": "open",
    "as_of": "2026-07-23",
    "evidence_state": "maintainer-listed"
  },
  "provenance": {
    "collection": "topp-open-finite",
    "sources": [
      {
        "url": "https://topp.openproblem.net/p28",
        "role": "status"
      }
    ]
  }
}
